{"claim_ids":["claim_0efdce485332ad33530b9c8a","claim_a2e7c42b9e108ea7ae2298b3","claim_9909bd8f6cd009ad5fbbd962","claim_575ce7e41fabb6e49c8ff7f3","claim_aed7f25b3037c7af9aeead08","claim_678198a45b83e2bf22433e03","claim_c7a4e00baff5565e45e2c77f","claim_f485c5e567c5090f08542d1c","claim_f8e6d7b09cdef6c3a37e8469","claim_c4ebc579fdcc38a1bdfca77e","claim_ad7883794c3d2bb64208c135","claim_1aaa0b78d53336eaa5c936c2","claim_7eadb968b4985bcfc731b21c","claim_53ada0b40b76de469e9e6121","claim_90e6d70031f9ef1e80ba1456","claim_dfcf17c7750af5c36223fe6b","claim_62a32cd1e8fec58f91e74ac3","claim_0574d99343b3aa1972f3648b","claim_4220bd8786081f91e8c2fc1e","claim_6264bfe90d9493afd395d95f","claim_4ae081feff0f54b8475c0e79","claim_d1523e00843577fbe7ebf934","claim_bdb48e99ed27d653aec687e1","claim_32224afd2652e87fc79503f0","claim_3649d41be361f9127a069a3d","claim_4286460c48677bb63904d42e","claim_afe75a54ab57f0a8f3237530","claim_a831f9807271cd2126dca469","claim_69d5b10a642246fa87b9f930","claim_c481db7b86f3752dfc35194f","claim_692951797c5fa44372be0a14","claim_3ee7eab4f2a5539cc6d86720","claim_2df8ac8dac7ef1f6fec44e09","claim_037b1f34afd9631363052025","claim_4d15eac186dff0edc90425c3","claim_aa4923a6ebc98186309b2d00","claim_8e86916ec31caf8e2cc964ad","claim_d9070d59e27d5406fbf9da31","claim_681a52ce1d99b29242f33cfe","claim_ffcb7d855246dc8a781c271d","claim_37ff2aa7db37ca785312d7f7","claim_d36a01b0bb3f09ef2136f01a","claim_b7002c2d5dc33f13c3cf5bf2","claim_052a86bd50395efe81a826e2","claim_ff7525dec9e8afc5c41f6225","claim_7b9b25bb408bd48c683a4ddb","claim_137e952869a3551af06890c5","claim_af941a9c257f84b4122b35cb","claim_7a8d602c1fcc95dce8093202","claim_b71b950dcd69f655b32e026a","claim_4c32c4ee0f20345f22043989","claim_eb5466c3945b869d7758adca","claim_d76d35f0faf1750d26935c5f","claim_ec36d86600fc402943707472","claim_6fb25e35e5cdeaab1a9e6ca6","claim_f625134dd861bbb2cb812e5f","claim_08a7ddadc69308a9d589a4d9","claim_226aeed8c87918b252380d57","claim_87807a98a28b16b5243d910f","claim_88a409da55a13dc958a6085d","claim_2169c77a8eb0958fe22d71e9","claim_b46e8108092cfe04f200bea1","claim_22cd4928f68b59456b3c717f","claim_defb251de8d0b5fbb66b056a","claim_a28cff77c4713a82215b65f1","claim_d346517c4cf8a24309df6f94","claim_17b787788e1d85d28a73a3b2","claim_f94eee751ef133a480d72b1e","claim_c1141b1856998b2786d72da2","claim_bb3fb5cfa4e6e3dcbb78d7dc","claim_2140c7f0586889ef1146775e","claim_9e576e8e96210ade2d1c6c78","claim_c31f92bccd224fa35cefcaa3","claim_84383e179a04593666639868","claim_f1d9b61ed6437b03289f8bb5","claim_56109a5c993b53224c514256","claim_1464148c50431b9c52a2cdce","claim_1b3c9019196a3331d4d4f07b","claim_cf913fbb8b78f13f49461b91","claim_bd5bbbf71f2a9bac674b6eec","claim_f1aa55d6f2ebbb3c6ee5529e","claim_9034223c30db84f98480009b","claim_b5889f0d99568ad675333849","claim_c5e3f1b2b584eee3639d9716","claim_06445808203d0c8137edb783","claim_d291698128df26053dbd5887","claim_e3c9572ca5ae0a0dad9cecd8","claim_ef3be0f9fbfdf2d1862da793"],"claim_snapshot_id":"claim-snapshot_d624b22c63bac876e8a40dd4","contract_version":1,"coverage_set_id":"coverage-set_05b1bc4c3c047c8ead2e490c","created_at":"2026-08-30T06:56:15.056066Z","data_cutoff":"2026-07-31T23:59:59+08:00","evidence_snapshot_id":"evidence-snapshot_24e785ae6b3fece458859295","project_id":"project_c337b1d8836ad714616a7756","report":"B","report_version":"v-fixture-b-pnh-001","schema_version":"1.0"}
